{
  "implementation": "stratasync-ts",
  "language": "typescript",
  "protocolVersion": 1,
  "corpusVersion": "2.5.1",
  "capabilities": [
    "bootstrap",
    "deltaFetch",
    "websocket",
    "outbox",
    "rebase",
    "archive",
    "syncGroups",
    "schemaHashGating"
  ],
  "notes": {
    "loadStrategies": "Implemented in packages/core (loadStrategy), but not yet declared: a capability is claimed once a scenario exercises it through the driver, not because the source contains it.",
    "partialLoad": "Same. packages/core carries partialLoadMode, no scenario covers it yet.",
    "undoRedo": "Same.",
    "crdt": "Provided by @stratasync/y-doc; no scenario covers it yet."
  }
}
